{
  "table": "expenses",
  "description": "Table for storing expense records including details like amount, category, vendor, and status.",
  "columns": [
    {
      "name": "id",
      "type": "uuid",
      "primaryKey": true,
      "notNull": true,
      "defaultFn": "uuid",
      "description": "Unique identifier for the expense record."
    },
    {
      "name": "expense_date",
      "type": "date",
      "notNull": true,
      "description": "Date when the expense occurred."
    },
    {
      "name": "amount",
      "type": "decimal",
      "notNull": true,
      "description": "Monetary amount of the expense."
    },
    {
      "name": "currency",
      "type": "text",
      "default": "USD",
      "description": "Currency code for the expense amount."
    },
    {
      "name": "description",
      "type": "text",
      "description": "Optional description of the expense."
    },
    {
      "name": "category_id",
      "type": "uuid",
      "notNull": true,
      "references": {
        "table": "expense_categories",
        "column": "id"
      },
      "description": "Foreign key to the expense category."
    },
    {
      "name": "vendor_id",
      "type": "uuid",
      "references": {
        "table": "vendors",
        "column": "id"
      },
      "description": "Optional foreign key to the vendor."
    },
    {
      "name": "payment_account_id",
      "type": "uuid",
      "references": {
        "table": "payment_accounts",
        "column": "id"
      },
      "description": "Optional foreign key to the payment account."
    },
    {
      "name": "reimbursable",
      "type": "boolean",
      "default": false,
      "description": "Indicates if the expense is reimbursable."
    },
    {
      "name": "status",
      "type": "text",
      "default": "posted",
      "enum": [
        "draft",
        "posted",
        "reimbursed"
      ],
      "description": "Status of the expense."
    },
    {
      "name": "receipt_url",
      "type": "text",
      "description": "Optional URL to the receipt image or document."
    },
    {
      "name": "created_by",
      "type": "uuid",
      "notNull": true,
      "references": {
        "table": "users",
        "column": "id"
      },
      "description": "Foreign key to the user who created the expense."
    },
    {
      "name": "created_at",
      "type": "timestamptz",
      "notNull": true,
      "description": "Timestamp when the expense was created."
    },
    {
      "name": "updated_at",
      "type": "timestamptz",
      "notNull": true,
      "description": "Timestamp when the expense was last updated."
    }
  ],
  "indexes": [
    {
      "name": "idx_expenses_created_by_expense_date",
      "columns": [
        "created_by",
        "expense_date"
      ],
      "unique": false
    },
    {
      "name": "idx_expenses_category_id",
      "columns": [
        "category_id"
      ],
      "unique": false
    },
    {
      "name": "idx_expenses_vendor_id",
      "columns": [
        "vendor_id"
      ],
      "unique": false
    },
    {
      "name": "idx_expenses_status",
      "columns": [
        "status"
      ],
      "unique": false
    }
  ]
}