{
  "table": "payment_accounts",
  "description": "Table for storing payment accounts",
  "columns": [
    {
      "name": "id",
      "type": "uuid",
      "primaryKey": true,
      "notNull": true,
      "defaultFn": "uuid",
      "description": "Unique identifier for the payment account"
    },
    {
      "name": "name",
      "type": "text",
      "notNull": true,
      "unique": true,
      "description": "Name of the payment account"
    },
    {
      "name": "type",
      "type": "text",
      "notNull": true,
      "description": "Type of the payment account (e.g., cash, credit_card, bank, other)"
    },
    {
      "name": "last4",
      "type": "text",
      "description": "Last four digits of the account (optional)"
    },
    {
      "name": "is_active",
      "type": "boolean",
      "notNull": true,
      "default": true,
      "description": "Whether the payment account is active"
    },
    {
      "name": "created_at",
      "type": "timestamptz",
      "notNull": true,
      "description": "Timestamp when the record was created"
    },
    {
      "name": "updated_at",
      "type": "timestamptz",
      "notNull": true,
      "description": "Timestamp when the record was last updated"
    }
  ],
  "indexes": [
    {
      "name": "idx_payment_accounts_is_active",
      "columns": [
        "is_active"
      ],
      "unique": false
    }
  ]
}